{
  "$schema": "https://json-schema.org/draft/2020-12/schema",
  "$id": "gdelt.schema.json",
  "title": "GDELT news volume",
  "description": "data/raw/gdelt/YYYY-MM-DD.json (UTC day of the fetch): per candidate and day, how many French-language articles in GDELT's raw Global Knowledge Graph files (translation stream) named the candidate in their title or their list of people, how many French-language articles the files held, and the mean GDELT tone of each. Fetches before 2026-10-18 read only the file at minute 00 of each hour and have no tone or files; later ones read every file. Fetches since 2026-10-19 also keep the matched articles and how Jev read them. A later fetch of the same day replaces an earlier one in data/clean/gdelt.csv.",
  "type": "object",
  "additionalProperties": false,
  "required": ["schema_version", "fetched_at", "start", "end", "candidates"],
  "properties": {
    "schema_version": {
      "const": "1.0"
    },
    "fetched_at": {
      "type": "string",
      "pattern": "^\\d{4}-\\d{2}-\\d{2}T\\d{2}:\\d{2}:\\d{2}Z$"
    },
    "start": {
      "$ref": "#/$defs/date"
    },
    "end": {
      "$ref": "#/$defs/date"
    },
    "articles": {
      "description": "The French articles whose title or address names a candidate, with where their text was read and Jev's stance probabilities for each candidate they name (fetches since 2026-10-19).",
      "type": "array",
      "items": {
        "type": "object",
        "additionalProperties": false,
        "required": ["date", "seen_at", "url", "title", "candidate_ids", "tone", "reached"],
        "properties": {
          "date": {
            "$ref": "#/$defs/date"
          },
          "seen_at": {
            "description": "When GDELT first listed it that day (UTC).",
            "type": "string",
            "pattern": "^\\d{4}-\\d{2}-\\d{2}T\\d{2}:\\d{2}:\\d{2}Z$"
          },
          "url": {
            "type": "string",
            "minLength": 1
          },
          "title": {
            "type": ["string", "null"]
          },
          "candidate_ids": {
            "type": "array",
            "minItems": 1,
            "items": {
              "type": "string",
              "pattern": "^[a-z][a-z0-9_]*$"
            }
          },
          "tone": {
            "type": "number"
          },
          "reached": {
            "enum": ["live", "archive", "unreachable"]
          },
          "stance": {
            "type": "object",
            "additionalProperties": {
              "type": "object",
              "additionalProperties": false,
              "required": ["favourable", "unfavourable", "neutral", "not_about"],
              "properties": {
                "favourable": {
                  "type": "number",
                  "minimum": 0,
                  "maximum": 1
                },
                "unfavourable": {
                  "type": "number",
                  "minimum": 0,
                  "maximum": 1
                },
                "neutral": {
                  "type": "number",
                  "minimum": 0,
                  "maximum": 1
                },
                "not_about": {
                  "type": "number",
                  "minimum": 0,
                  "maximum": 1
                }
              }
            }
          }
        }
      }
    },
    "candidates": {
      "type": "array",
      "items": {
        "type": "object",
        "additionalProperties": false,
        "required": ["candidate_id", "query", "status", "error", "days"],
        "properties": {
          "candidate_id": {
            "type": "string",
            "pattern": "^[a-z][a-z0-9_]*$"
          },
          "query": {
            "type": "string",
            "minLength": 1
          },
          "status": {
            "enum": ["ok", "error"]
          },
          "error": {
            "type": ["string", "null"]
          },
          "days": {
            "type": "array",
            "items": {
              "type": "object",
              "additionalProperties": false,
              "required": ["date", "articles", "total_articles"],
              "properties": {
                "date": {
                  "$ref": "#/$defs/date"
                },
                "articles": {
                  "type": "integer",
                  "minimum": 0
                },
                "total_articles": {
                  "type": "integer",
                  "minimum": 0
                },
                "tone": {
                  "description": "Mean GDELT tone (V2Tone: positive minus negative words, in percent of the words) of the articles naming the candidate; null without any.",
                  "type": ["number", "null"]
                },
                "total_tone": {
                  "description": "Mean GDELT tone of every French article that day.",
                  "type": ["number", "null"]
                },
                "files": {
                  "description": "GDELT files read for the day (96 when none is missing).",
                  "type": "integer",
                  "minimum": 1,
                  "maximum": 96
                },
                "stance": {
                  "description": "How Jev read the day's articles naming the candidate: those read and about them, the sums of their favourable, unfavourable and neutral probabilities (renormalised without not_about), those Jev found not about the candidate, and those whose text could not be reached live or in the Internet Archive.",
                  "type": "object",
                  "additionalProperties": false,
                  "required": ["read", "favourable", "unfavourable", "neutral", "not_about", "unreachable"],
                  "properties": {
                    "read": {
                      "type": "integer",
                      "minimum": 0
                    },
                    "favourable": {
                      "type": "number",
                      "minimum": 0
                    },
                    "unfavourable": {
                      "type": "number",
                      "minimum": 0
                    },
                    "neutral": {
                      "type": "number",
                      "minimum": 0
                    },
                    "not_about": {
                      "type": "integer",
                      "minimum": 0
                    },
                    "unreachable": {
                      "type": "integer",
                      "minimum": 0
                    }
                  }
                }
              }
            }
          }
        }
      }
    }
  },
  "$defs": {
    "date": {
      "type": "string",
      "pattern": "^\\d{4}-\\d{2}-\\d{2}$"
    }
  }
}
