{
  "candidates": [
    {
      "candidate_id": "arthaud",
      "days": [
        {
          "articles": 0,
          "date": "2026-10-26",
          "files": 96,
          "total_articles": 9824,
          "total_tone": -1.0511
        },
        {
          "articles": 0,
          "date": "2026-10-27",
          "files": 96,
          "total_articles": 10308,
          "total_tone": -0.9351
        },
        {
          "articles": 0,
          "date": "2026-10-28",
          "files": 96,
          "total_articles": 10398,
          "total_tone": -0.9875
        }
      ],
      "error": null,
      "query": "GDELT GKG translation stream, srclc:fra, every file; title or URL slug: Nathalie Arthaud | Arthaud",
      "status": "ok"
    },
    {
      "candidate_id": "asselineau",
      "days": [
        {
          "articles": 0,
          "date": "2026-10-26",
          "files": 96,
          "total_articles": 9824,
          "total_tone": -1.0511
        },
        {
          "articles": 0,
          "date": "2026-10-27",
          "files": 96,
          "total_articles": 10308,
          "total_tone": -0.9351
        },
        {
          "articles": 1,
          "date": "2026-10-28",
          "files": 96,
          "tone": -8.011,
          "total_articles": 10398,
          "total_tone": -0.9875
        }
      ],
      "error": null,
      "query": "GDELT GKG translation stream, srclc:fra, every file; title or URL slug: François Asselineau | Asselineau",
      "status": "ok"
    },
    {
      "candidate_id": "attal",
      "days": [
        {
          "articles": 1,
          "date": "2026-10-26",
          "files": 96,
          "tone": 3.9773,
          "total_articles": 9824,
          "total_tone": -1.0511
        },
        {
          "articles": 6,
          "date": "2026-10-27",
          "files": 96,
          "tone": -2.379,
          "total_articles": 10308,
          "total_tone": -0.9351
        },
        {
          "articles": 27,
          "date": "2026-10-28",
          "files": 96,
          "tone": -1.1803,
          "total_articles": 10398,
          "total_tone": -0.9875
        }
      ],
      "error": null,
      "query": "GDELT GKG translation stream, srclc:fra, every file; title or URL slug: Gabriel Attal | Attal",
      "status": "ok"
    },
    {
      "candidate_id": "bardella",
      "days": [
        {
          "articles": 14,
          "date": "2026-10-26",
          "files": 96,
          "tone": -4.1968,
          "total_articles": 9824,
          "total_tone": -1.0511
        },
        {
          "articles": 5,
          "date": "2026-10-27",
          "files": 96,
          "tone": -5.8608,
          "total_articles": 10308,
          "total_tone": -0.9351
        },
        {
          "articles": 6,
          "date": "2026-10-28",
          "files": 96,
          "tone": 0.2018,
          "total_articles": 10398,
          "total_tone": -0.9875
        }
      ],
      "error": null,
      "query": "GDELT GKG translation stream, srclc:fra, every file; title or URL slug: Jordan Bardella | Bardella",
      "status": "ok"
    },
    {
      "candidate_id": "batho",
      "days": [
        {
          "articles": 0,
          "date": "2026-10-26",
          "files": 96,
          "total_articles": 9824,
          "total_tone": -1.0511
        },
        {
          "articles": 0,
          "date": "2026-10-27",
          "files": 96,
          "total_articles": 10308,
          "total_tone": -0.9351
        },
        {
          "articles": 0,
          "date": "2026-10-28",
          "files": 96,
          "total_articles": 10398,
          "total_tone": -0.9875
        }
      ],
      "error": null,
      "query": "GDELT GKG translation stream, srclc:fra, every file; title or URL slug: Delphine Batho",
      "status": "ok"
    },
    {
      "candidate_id": "becht",
      "days": [
        {
          "articles": 0,
          "date": "2026-10-26",
          "files": 96,
          "total_articles": 9824,
          "total_tone": -1.0511
        },
        {
          "articles": 0,
          "date": "2026-10-27",
          "files": 96,
          "total_articles": 10308,
          "total_tone": -0.9351
        },
        {
          "articles": 0,
          "date": "2026-10-28",
          "files": 96,
          "total_articles": 10398,
          "total_tone": -0.9875
        }
      ],
      "error": null,
      "query": "GDELT GKG translation stream, srclc:fra, every file; title or URL slug: Olivier Becht",
      "status": "ok"
    },
    {
      "candidate_id": "bertrand",
      "days": [
        {
          "articles": 1,
          "date": "2026-10-26",
          "files": 96,
          "tone": -6.0109,
          "total_articles": 9824,
          "total_tone": -1.0511
        },
        {
          "articles": 0,
          "date": "2026-10-27",
          "files": 96,
          "total_articles": 10308,
          "total_tone": -0.9351
        },
        {
          "articles": 0,
          "date": "2026-10-28",
          "files": 96,
          "total_articles": 10398,
          "total_tone": -0.9875
        }
      ],
      "error": null,
      "query": "GDELT GKG translation stream, srclc:fra, every file; title or URL slug: Xavier Bertrand",
      "status": "ok"
    },
    {
      "candidate_id": "bonnal",
      "days": [
        {
          "articles": 0,
          "date": "2026-10-26",
          "files": 96,
          "total_articles": 9824,
          "total_tone": -1.0511
        },
        {
          "articles": 0,
          "date": "2026-10-27",
          "files": 96,
          "total_articles": 10308,
          "total_tone": -0.9351
        },
        {
          "articles": 0,
          "date": "2026-10-28",
          "files": 96,
          "total_articles": 10398,
          "total_tone": -0.9875
        }
      ],
      "error": null,
      "query": "GDELT GKG translation stream, srclc:fra, every file; title or URL slug: Sébastien Bonnal",
      "status": "ok"
    },
    {
      "candidate_id": "bouamrane",
      "days": [
        {
          "articles": 0,
          "date": "2026-10-26",
          "files": 96,
          "total_articles": 9824,
          "total_tone": -1.0511
        },
        {
          "articles": 0,
          "date": "2026-10-27",
          "files": 96,
          "total_articles": 10308,
          "total_tone": -0.9351
        },
        {
          "articles": 0,
          "date": "2026-10-28",
          "files": 96,
          "total_articles": 10398,
          "total_tone": -0.9875
        }
      ],
      "error": null,
      "query": "GDELT GKG translation stream, srclc:fra, every file; title or URL slug: Karim Bouamrane | Bouamrane",
      "status": "ok"
    },
    {
      "candidate_id": "cazeneuve",
      "days": [
        {
          "articles": 1,
          "date": "2026-10-26",
          "files": 96,
          "tone": -4.5139,
          "total_articles": 9824,
          "total_tone": -1.0511
        },
        {
          "articles": 0,
          "date": "2026-10-27",
          "files": 96,
          "total_articles": 10308,
          "total_tone": -0.9351
        },
        {
          "articles": 0,
          "date": "2026-10-28",
          "files": 96,
          "total_articles": 10398,
          "total_tone": -0.9875
        }
      ],
      "error": null,
      "query": "GDELT GKG translation stream, srclc:fra, every file; title or URL slug: Bernard Cazeneuve | Cazeneuve",
      "status": "ok"
    },
    {
      "candidate_id": "dupont_aignan",
      "days": [
        {
          "articles": 0,
          "date": "2026-10-26",
          "files": 96,
          "total_articles": 9824,
          "total_tone": -1.0511
        },
        {
          "articles": 2,
          "date": "2026-10-27",
          "files": 96,
          "tone": 0.3199,
          "total_articles": 10308,
          "total_tone": -0.9351
        },
        {
          "articles": 0,
          "date": "2026-10-28",
          "files": 96,
          "total_articles": 10398,
          "total_tone": -0.9875
        }
      ],
      "error": null,
      "query": "GDELT GKG translation stream, srclc:fra, every file; title or URL slug: Nicolas Dupont-Aignan | Dupont-Aignan",
      "status": "ok"
    },
    {
      "candidate_id": "faure",
      "days": [
        {
          "articles": 1,
          "date": "2026-10-26",
          "files": 96,
          "tone": -0.7168,
          "total_articles": 9824,
          "total_tone": -1.0511
        },
        {
          "articles": 0,
          "date": "2026-10-27",
          "files": 96,
          "total_articles": 10308,
          "total_tone": -0.9351
        },
        {
          "articles": 0,
          "date": "2026-10-28",
          "files": 96,
          "total_articles": 10398,
          "total_tone": -0.9875
        }
      ],
      "error": null,
      "query": "GDELT GKG translation stream, srclc:fra, every file; title or URL slug: Olivier Faure",
      "status": "ok"
    },
    {
      "candidate_id": "glucksmann",
      "days": [
        {
          "articles": 17,
          "date": "2026-10-26",
          "files": 96,
          "tone": -3.0118,
          "total_articles": 9824,
          "total_tone": -1.0511
        },
        {
          "articles": 6,
          "date": "2026-10-27",
          "files": 96,
          "tone": -1.3362,
          "total_articles": 10308,
          "total_tone": -0.9351
        },
        {
          "articles": 8,
          "date": "2026-10-28",
          "files": 96,
          "tone": -2.1468,
          "total_articles": 10398,
          "total_tone": -0.9875
        }
      ],
      "error": null,
      "query": "GDELT GKG translation stream, srclc:fra, every file; title or URL slug: Raphaël Glucksmann | Glucksmann",
      "status": "ok"
    },
    {
      "candidate_id": "guedj",
      "days": [
        {
          "articles": 1,